{
  "schema_version": 3,
  "contract_id": "RESPONSE-DEMO-001",
  "goal_id": "GOAL-DEMO-001",
  "origin": "FINALIZATION",
  "execution_path": "AGENT_TURN",
  "response_class": "RESULT",
  "completion_requirement": "RESULT_NOW",
  "channel": "CHAT_AND_ARTIFACT",
  "status_delivery": "NOT_APPLICABLE",
  "mandatory_slots": ["RESULT", "EVIDENCE", "VERIFICATION", "ARTIFACT", "LIMITATIONS"],
  "soft_text_token_budget": 240,
  "budget_basis": "MANDATORY_SLOT_ESTIMATE",
  "text_policy": "CONCISE_COMPLETE",
  "information_delta": "FINAL",
  "dedupe_key_hmac_sha256": "6666666666666666666666666666666666666666666666666666666666666666",
  "artifact_policy": "ARTIFACT_FIRST",
  "directive_placement": "DYNAMIC_SUFFIX",
  "budget_behavior": "EXPAND_FOR_REQUIRED_CONTENT",
  "goal_level_rebound_guard": true,
  "generated_content_accounting": "PROVIDER_OUTPUT_WITH_REASONING_AND_TOOL_ARGUMENT_ATTRIBUTION",
  "tool_result_projection_policy": "EVIDENCE_LIVENESS_ROUTED",
  "preserve_user_requested_format": true,
  "suppress_when": ["DUPLICATE_PROJECTION", "ROUTINE_CHECKPOINT"],
  "hard_truncation_allowed": false,
  "rewrite_request_allowed": false,
  "reason": "Return a concise verified result while keeping the complete report in ArtifactStore."
}
